ressource_name,presentation,stored_text,is_rollable,is_stored,base_building_cost,base_moving_cost,location_repaire_cost,gain_rules,hide_when_zero
Koku,"La production excédentaire de votre clan qui est disponible dans vos entrepôts a une valeur de <strong>%s %s</strong>.",,1,0,1000,800,800,"[{""amount"":100,""timing"":""before_claim"",""condition"":{""type"":""claims_zone""}},{""amount"":200,""timing"":""before_claim"",""condition"":{""type"":""holds_zone""}},{""amount"":100,""timing"":""after_claim"",""condition"":{""type"":""owns_location_type"",""location_type"":""temple""}},{""amount"":100,""timing"":""after_claim"",""condition"":{""type"":""owns_location_type"",""location_type"":""fortress""}}]",0
Cheval de Takamatsu,"Nous avons à notre disposition <strong>%s montures</strong> sûres et rapides élevées par les renommées Écuries de Takamatsu.",,1,0,0,0,0,"[{""amount"":1,""timing"":""before_claim"",""condition"":{""type"":""claims_zone"",""zone_name"":""Province de Sanuki""}},{""amount"":2,""timing"":""before_claim"",""condition"":{""type"":""holds_zone"",""zone_name"":""Province de Sanuki""}}]",1
Armure en fer de Kubokawa,"Nous avons à notre disposition <strong>%s cuirasses</strong> forgées dans l’acier sombre de la Mine de fer de Kubokawa.",,1,0,0,0,0,"[{""amount"":1,""timing"":""before_claim"",""condition"":{""type"":""claims_zone"",""zone_name"":""Cap sud de Tosa""}},{""amount"":2,""timing"":""before_claim"",""condition"":{""type"":""holds_zone"",""zone_name"":""Cap sud de Tosa""}}]",1
Thé d’Oboké,"Nous avons à notre disposition <strong>%s paquets</strong> de feuilles de thé de la Vallée fertile d’Oboké.",,1,0,0,0,0,"[{""amount"":1,""timing"":""before_claim"",""condition"":{""type"":""claims_zone"",""zone_name"":""Vallée d’Iya et d’Oboké d’Awa""}},{""amount"":2,""timing"":""before_claim"",""condition"":{""type"":""holds_zone"",""zone_name"":""Vallée d’Iya et d’Oboké d’Awa""}}]",1
Encens Coréen,"Nous avons à notre disposition <strong>%s bâtonnets</strong> d'encens introuvables au Japon, débarqués depuis la Corée.",,1,0,0,0,0,"[{""amount"":1,""timing"":""before_claim"",""condition"":{""type"":""claims_zone"",""zone_name"":""Côte Ouest d’Iyo""}},{""amount"":2,""timing"":""before_claim"",""condition"":{""type"":""holds_zone"",""zone_name"":""Côte Ouest d’Iyo""}}]",1
